{"schema_version":1,"workspace_id":"ws_alpha","scope":{"kind":"project","project_id":"proj"},"evidence_id":"evidence_legacy","evidence_kind":"compatibility_import","quality":"best_effort","state":"persisted","authority":{"authority_kind":"trusted_importer","identity":"importer","implementation_revision":"r1","capability_profile_id":"compatibility_reader","capability_profile_revision":"p1"},"subject":{"legacy_locator":"/sealed/evidence.json"},"correlation_id":"import_tx2","observed_at_utc":"2026-07-19T00:00:00Z","integrity":"sha256:0239509121cef357e44c5c793e827dc96021f74f3613d782c4b488f99d88e897","legacy_manifest":{"manifest_id":"manifest_one","cutoff_policy_revision":"p1","sealed":true,"entries":[{"canonical_locator":"/sealed/evidence.json","content_hash":"984845d2117bd645aba91ea1c0fc3993bf0f5086570d162f1a970655bba5a1fb","evidence_form_version":"v1","cutoff_policy_revision":"p1","source_workspace_id":"ws_alpha","source_project_id":"proj","source_registry_revision":"rev1","source_boundary":{"kind":"source_snapshot","identity":"snapshot1","immutable":true},"trusted_importer":{"identity":"importer","revision":"r1"},"transaction_id":"source_tx1","provenance_id":"source_prov1","integrity":"422ca57986cdd1edaff2ff724cd4fb8220ccbea530702658552e576b168fc037"}],"publication":{"publisher":{"identity":"publisher","revision":"r1"},"publication_transaction_id":"publish_tx1","provenance_id":"publish_prov1","workspace_id":"ws_alpha","project_id":"proj","registry_revision":"rev1","cutoff_policy_revision":"p1","source_boundary":{"kind":"source_snapshot","identity":"snapshot1","immutable":true},"integrity":"9fe214dc780223e41d48d2b50b17df321e5d8b418ad345b332abda989e20c250"},"seal":{"algorithm":"sha256","value":"0310515889279abdd1cfafd58b29fb61c7600a24858d85eef3f9c6c8a59ad3cd"}},"legacy_import":{"manifest_id":"manifest_one","cutoff_policy_revision":"p1","entry_key":{"canonical_locator":"/sealed/evidence.json","content_hash":"984845d2117bd645aba91ea1c0fc3993bf0f5086570d162f1a970655bba5a1fb","evidence_form_version":"v1","cutoff_policy_revision":"p1"},"recorded_content_type":"application/json","recorded_bytes_base64":"eyJjbGFpbSI6ImxlZ2FjeSJ9","source_boundary":{"kind":"source_snapshot","identity":"snapshot1","immutable":true},"source_transaction_id":"source_tx1","source_provenance_id":"source_prov1","importer":{"identity":"importer","revision":"r1"},"import_transaction_id":"import_tx2","import_provenance_id":"import_prov2","integrity":"03e2ae50271cfcc0cb07fa35cef33787ca63035f7d6a79e2710e9b27c114ef96"}}
